{
  "id": "anzsrc-2020-for-psychology-fields",
  "record_type": "reference_system",
  "title": "ANZSRC 2020 FoR Division 52 Psychology fields",
  "authority": "Australian Bureau of Statistics, Stats NZ, Australian Research Council, and New Zealand Ministry of Business, Innovation and Employment",
  "scope": "All 36 field-level codes nested under the six groups of ANZSRC 2020 Fields of Research Division 52 Psychology. This is an Australia and New Zealand R&D statistical classification, not a global ontology. Indigenous psychology is explicitly located outside Division 52 in Division 45 Indigenous studies.",
  "version": "2020-data-cube-corrected-2025-10-24",
  "retrieved_at": "2026-07-23",
  "source_ids": [
    "abs-anzsrc-2020-release",
    "abs-anzsrc-2020-for-data-cube"
  ],
  "candidate_ids": [
    "anzsrc-520101",
    "anzsrc-520102",
    "anzsrc-520103",
    "anzsrc-520104",
    "anzsrc-520105",
    "anzsrc-520106",
    "anzsrc-520107",
    "anzsrc-520108",
    "anzsrc-520199",
    "anzsrc-520201",
    "anzsrc-520202",
    "anzsrc-520203",
    "anzsrc-520204",
    "anzsrc-520205",
    "anzsrc-520206",
    "anzsrc-520207",
    "anzsrc-520299",
    "anzsrc-520301",
    "anzsrc-520302",
    "anzsrc-520303",
    "anzsrc-520304",
    "anzsrc-520399",
    "anzsrc-520401",
    "anzsrc-520402",
    "anzsrc-520403",
    "anzsrc-520404",
    "anzsrc-520405",
    "anzsrc-520406",
    "anzsrc-520499",
    "anzsrc-520501",
    "anzsrc-520502",
    "anzsrc-520503",
    "anzsrc-520504",
    "anzsrc-520505",
    "anzsrc-520599",
    "anzsrc-529999"
  ],
  "status": "retrieved",
  "publishable": false,
  "provenance": "reference_system",
  "notes": "The inventory is complete at field level. Pending decisions remain explicit until each group is adjudicated; coverage completeness must not be confused with resolution."
}
